{
  "$ref": "#/definitions/course",
  "definitions": {
    "course": {
      "type": "object",
      "properties": {
        "schemaVersion": {
          "type": "integer",
          "default": 1
        },
        "slug": {
          "type": "string"
        },
        "title": {
          "type": "string"
        },
        "description": {
          "type": "string"
        },
        "accentColor": {
          "type": "string",
          "enum": [
            "default",
            "indigo",
            "emerald",
            "terracotta",
            "black"
          ]
        },
        "icon": {
          "type": "string"
        },
        "modules": {
          "type": "array",
          "items": {
            "type": "object",
            "properties": {
              "id": {
                "type": "string"
              },
              "title": {
                "type": "string"
              },
              "summary": {
                "type": "string"
              },
              "lessons": {
                "type": "array",
                "items": {
                  "type": "object",
                  "properties": {
                    "slug": {
                      "type": "string"
                    },
                    "title": {
                      "type": "string"
                    },
                    "estimatedMinutes": {
                      "type": "integer",
                      "exclusiveMinimum": 0
                    },
                    "summary": {
                      "type": "string"
                    }
                  },
                  "required": [
                    "slug",
                    "title",
                    "estimatedMinutes"
                  ],
                  "additionalProperties": false
                }
              }
            },
            "required": [
              "id",
              "title",
              "summary",
              "lessons"
            ],
            "additionalProperties": false
          }
        },
        "createdAt": {
          "type": "string"
        },
        "updatedAt": {
          "type": "string"
        }
      },
      "required": [
        "slug",
        "title",
        "description",
        "accentColor",
        "icon",
        "modules",
        "createdAt",
        "updatedAt"
      ],
      "additionalProperties": false
    }
  },
  "$schema": "http://json-schema.org/draft-07/schema#"
}
