{
  "schemaVersion": 1,
  "slug": "gauss-basics",
  "title": "Podstawy filtrowania Gaussa w wizji komputerowej",
  "description": "Krótki kurs o filtrowaniu obrazów filtrem Gaussa: od konwolucji i typów filtrów po praktyczne użycie scipy.ndimage z testami i interaktywnym demo.",
  "accentColor": "indigo",
  "icon": "image",
  "modules": [
    {
      "id": "m1",
      "title": "Filtry liniowe i Gauss",
      "summary": "Wprowadzenie do konwolucji, typów filtrów (LP/HP) i samego filtru Gaussa — z teorią, quizem, demo, kodem i piaskownicami.",
      "lessons": [
        {
          "slug": "wprowadzenie-do-filtrowania",
          "title": "Wprowadzenie do filtrowania obrazów",
          "estimatedMinutes": 15
        },
        {
          "slug": "filtr-gaussa-w-praktyce",
          "title": "Filtr Gaussa w praktyce",
          "estimatedMinutes": 25
        }
      ]
    }
  ],
  "createdAt": "2026-05-01T00:00:00Z",
  "updatedAt": "2026-05-01T00:00:00Z"
}
