{
  "schemaVersion": 1,
  "slug": "video-test",
  "title": "Video Test",
  "description": "Smoke test course for the Video widget.",
  "accentColor": "indigo",
  "icon": "play",
  "modules": [
    {
      "id": "m1",
      "title": "Video module",
      "summary": "Embed YouTube and MP4 with clickable transcripts.",
      "lessons": [
        {
          "slug": "neural-net-intro",
          "title": "Neural net intro",
          "estimatedMinutes": 10
        },
        {
          "slug": "mp4-demo",
          "title": "MP4 demo",
          "estimatedMinutes": 5
        }
      ]
    }
  ],
  "createdAt": "2026-05-04T00:00:00Z",
  "updatedAt": "2026-05-04T00:00:00Z"
}
