{
  "schemaVersion": 1,
  "slug": "tts-stt-test",
  "title": "TTS + STT Test",
  "description": "Smoke test course for the TtsDemo + SttDemo speech widgets (US-160).",
  "accentColor": "terracotta",
  "icon": "mic",
  "modules": [
    {
      "id": "m1",
      "title": "Speech pipelines",
      "summary": "Verify both speech pipelines end-to-end without generating a whole course.",
      "lessons": [
        { "slug": "speech-demo", "title": "Speech demo", "estimatedMinutes": 3 }
      ]
    }
  ],
  "createdAt": "2026-05-11T00:00:00Z",
  "updatedAt": "2026-05-11T00:00:00Z"
}
