{
  "schemaVersion": 1,
  "slug": "audio-test",
  "title": "Audio Test",
  "description": "AudioPlayer widget smoke test (US-155).",
  "accentColor": "indigo",
  "icon": "headphones",
  "modules": [
    {
      "id": "m1",
      "title": "Audio",
      "summary": "Smoke-test the AudioPlayer widget.",
      "lessons": [
        { "slug": "audio-demo", "title": "Audio demo", "estimatedMinutes": 3 }
      ]
    }
  ],
  "createdAt": "2026-05-09T00:00:00Z",
  "updatedAt": "2026-05-09T00:00:00Z"
}
