{
  "schemaVersion": 1,
  "slug": "datatable-test",
  "title": "DataTable Test",
  "description": "Smoke test course for the DataTable widget.",
  "accentColor": "indigo",
  "icon": "sigma",
  "modules": [
    {
      "id": "m1",
      "title": "DataTable module",
      "summary": "Render datasets inline with sort/filter/paginate.",
      "lessons": [
        {
          "slug": "scores",
          "title": "Student scores",
          "estimatedMinutes": 5
        }
      ]
    }
  ],
  "createdAt": "2026-05-04T00:00:00Z",
  "updatedAt": "2026-05-04T00:00:00Z"
}
