{
  "schemaVersion": 1,
  "slug": "quiz-test",
  "title": "Quiz Reference",
  "description": "Per-widget reference course for the Quiz widget. Covers single-select, multi-select, explanation panels, and a realistic didactic check-your-understanding lesson on Python list semantics.",
  "accentColor": "emerald",
  "icon": "target",
  "modules": [
    {
      "id": "m1",
      "title": "Quiz widget reference",
      "summary": "Three lessons that cover the Quiz widget's modes (single + multi), feedback rendering, and a real check-your-understanding sweep.",
      "lessons": [
        {
          "slug": "single-select",
          "title": "Single-select — one correct answer",
          "estimatedMinutes": 4
        },
        {
          "slug": "multi-select",
          "title": "Multi-select — multiple correct answers",
          "estimatedMinutes": 5
        },
        {
          "slug": "python-lists-quiz",
          "title": "Didactic example — check your Python list intuition",
          "estimatedMinutes": 8
        }
      ]
    }
  ],
  "createdAt": "2026-05-04T00:00:00Z",
  "updatedAt": "2026-05-04T00:00:00Z"
}
