{
  "schemaVersion": 1,
  "slug": "cloze-test",
  "title": "CodeCloze Test",
  "description": "Smoke test course for the CodeCloze widget.",
  "accentColor": "indigo",
  "icon": "code",
  "modules": [
    {
      "id": "m1",
      "title": "Cloze module",
      "summary": "Fill-in-the-blank coding playground.",
      "lessons": [
        {
          "slug": "box-blur",
          "title": "Box blur cloze",
          "estimatedMinutes": 5
        }
      ]
    }
  ],
  "createdAt": "2026-05-03T00:00:00Z",
  "updatedAt": "2026-05-03T00:00:00Z"
}
